{
  "$schema": "http://json-schema.org/schema#",
  "$id": "http://marklogic.com/data-hub/Flow.schema.json",
  "title": "Flow",
  "type": "object",
  "description": "A Data Hub flow containing zero or many steps",
  "properties": {
    "name": {
      "type": "string",
      "description": "Unique name for the flow"
    },
    "description": {
      "type": "string",
      "description": "Optional description of the flow"
    },
    "batchSize": {
      "type": "number",
      "description": "Default batch size for every step"
    },
    "threadCount": {
      "type": "number",
      "description": "Default thread count for every step"
    },
    "stopOnError": {
      "type": "boolean",
      "description": "If true and an error is encountered, the flow run ends, the rest of the source data is ignored, and the remaining steps are not performed. Information about the failure is logged in the job document. Default is false."
    },
    "options": {
      "type": "object",
      "description": "Default options for every step. Not yet known what is typically defined here; may be rarely used",
      "properties": {
      }
    },
    "version": {
      "type": "number",
      "description": "Does not appear to be used for anything"
    },
    "steps": {
      "type": "object",
      "additionalProperties": false,
      "patternProperties": {
        "^[0-9]+$": {
          "oneOf": [
            {
              "properties": {
                "name": {
                  "type": "string",
                  "description": "Name of step, though the 'step number' is how a step is referred to when running a flow"
                },
                "description": {
                  "type": "string",
                  "description": "Optional description of the step"
                },
                "stepDefinitionName": {
                  "type": "string"
                },
                "stepDefinitionType": {
                  "type": "string"
                },
                "batchSize": {
                  "type": "number",
                  "description": "If set, overrides the batchSize defined at the flow level and in the step definition"
                },
                "threadCount": {
                  "type": "number",
                  "description": "If set, overrides the threadCount defined at the flow level and in the step definition"
                },
                "customHook": {
                  "type": "object",
                  "$ref": "./CustomHook.schema.json"
                },
                "processors": {
                  "type": "array",
                  "items": {
                    "type": "object",
                    "properties": {
                      "path": {
                        "type": "string",
                        "description": "Path to a module in the modules database that will be invoked via xdmp.invoke"
                      },
                      "when": {
                        "type": "string",
                        "description": "When the processor should be invoked. Only 'beforeContentPersisted' is supported."
                      },
                      "vars": {
                        "type": "object",
                        "description": "Any properties defined in this object are passed to the invoked module"
                      }
                    }
                  }
                },
                "fileLocations": {
                  "type": "object",
                  "description": "Applicable only to ingestion steps run via Gradle or QuickStart; not applicable when using MLCP",
                  "properties": {
                    "inputFilePath": {
                      "type": "string"
                    },
                    "inputFileType": {
                      "type": "string"
                    },
                    "outputURIReplacement": {
                      "type": "string"
                    },
                    "outputURIPrefix": {
                      "type": "string"
                    },
                    "separator": {
                      "type": "string"
                    }
                  }
                },
                "options": {
                  "type": "object",
                  "properties": {
                    "sourceQuery": {
                      "type": "string",
                      "description": "Defines the items to be processed by the step; must be a cts.query or cts.uris statement if sourceQueryIsScript is false"
                    },
                    "sourceQueryIsScript": {
                      "type": "boolean",
                      "description": "Added in 5.3.0; if true, then sourceQuery can be any JavaScript statement that can be passed into xdmp.eval"
                    },
                    "constrainSourceQueryToJob": {
                      "type": "boolean",
                      "description": "If true, the query is applied to the documents that were created or modified in the same job that executes the step"
                    },
                    "excludeAlreadyProcessed": {
                      "type": "boolean",
                      "description": "Added in 5.4.0; if true, then any items returned by the sourceQuery will be excluded from processing if a Batch document indicates that the item was processed by this step already"
                    },
                    "provenanceGranularityLevel": {
                      "type": "string",
                      "description": "The granularity of the provenance tracking information: coarse (default) to store document-level provenance information only, fine to store document-level and property-level provenance information, or off to disable provenance tracking in future job runs. Applies only to mapping, matching, merging, mastering, and custom steps."
                    },
                    "stepUpdate": {
                      "type": "boolean",
                      "description": "If true, custom modules can make changes directly to records in the database"
                    },
                    "acceptsBatch": {
                      "type": "boolean",
                      "description": "If true, the step module is invoked once with all records in the batch passed to it"
                    },
                    "collections": {
                      "type": "array",
                      "items": {
                        "type": "string"
                      }
                    },
                    "additionalCollections": {
                      "type": "array",
                      "items": {
                        "type": "string"
                      }
                    },
                    "permissions": {
                      "type": "string",
                      "description": "Comma-delimited string of role,capability,role,capability,etc"
                    },
                    "outputFormat": {
                      "type": "string"
                    },
                    "sourceDatabase": {
                      "type": "string"
                    },
                    "targetDatabase": {
                      "type": "string"
                    },
                    "targetEntity": {
                      "type": "string",
                      "description": "Name of the entity type associated with the output of the step"
                    },
                    "validateEntity": {
                      "type": "boolean",
                      "description": "Applicable to mapping steps only"
                    },
                    "headers": {
                      "type": "object",
                      "description": "Any properties in this object will be copied into the headers of each document processed by the step"
                    },
                    "mapping": {
                      "type": "object",
                      "properties": {
                        "name": {
                          "type": "string",
                          "description": "The name of your mapping that is defined in your-project-root/mappings/your-mapping-name/mapping.version.json"
                        },
                        "version": {
                          "type": "string",
                          "description": "The version of the mapping to use, as defined in the mapping artifact"
                        }
                      }
                    },
                    "matchOptions": {
                      "type": "object"
                    },
                    "mergeOptions": {
                      "type": "object"
                    }
                  }
                }
              }
            },
            {
              "properties": {
                "stepId": {
                  "type": "string",
                  "description": "stepID links to an external step document"
                }
              },
              "required": [
                "stepId"
              ]
            }
          ],
          "type": "object"
        }
      }
    }
  },
  "required": [
    "name"
  ]
}
