{
  "name": "ingestion_mapping_mastering-flow",
  "description": "This is the default flow containing all of the default steps",
  "batchSize": 100,
  "threadCount": 4,
  "options": {
    "sourceQuery": null
  },
  "steps": {
    "1": {
      "name": "ingest-step-json",
      "description": "ingests json docs to data-hub-STAGING",
      "stepDefinitionName": "default-ingestion",
      "stepDefinitionType": "INGESTION",
      "options": {
        "sourceQuery": null,
        "collections": [
          "mastering-flow-ingest-json"
        ],
        "permissions": "rest-reader,read,rest-writer,update",
        "outputFormat": "json",
        "targetDatabase": "data-hub-STAGING"
      },
      "customHook": {},
      "retryLimit": 0,
      "batchSize": 100,
      "threadCount": 4,
      "fileLocations": {
        "inputFilePath": "mastering-input",
        "inputFileType": "json",
        "outputURIReplacement": ".*input*.,'/mastering-flow/json/'"
      }
    },
    "2": {
      "name": "mapping-step-json",
      "description": "maps and harmonizes docs to data-hub-FINAL",
      "stepDefinitionName": "default-mapping",
      "stepDefinitionType": "MAPPING",
      "options": {
        "sourceQuery": "cts.collectionQuery('mastering-flow-ingest-json')",
        "mapping": {
          "name": "OrderMappingJson",
          "version": 1
        },
        "sourceDatabase": "data-hub-STAGING",
        "collections": [
          "mastering-flow-mapping-json",
          "mdm-content"
        ],
        "outputFormat": "json",
        "targetDatabase": "data-hub-FINAL"
      },
      "customHook": null,
      "retryLimit": 0,
      "batchSize": 0,
      "threadCount": 0
    },
    "3": {
      "name": "json-mastering-step-json",
      "description": "matches and merges the docs",
      "stepDefinitionName": "default-mastering",
      "stepDefinitionType": "MASTERING",
      "options": {
        "stepUpdate": true,
        "sourceQuery": "cts.collectionQuery('mastering-flow-mapping-json')",
        "acceptsBatch": true,
        "targetEntity": "Order",
        "sourceDatabase": "data-hub-FINAL",
        "collections": [
          "mastered1"
        ],
        "mergeOptions": {
          "propertyDefs": {
            "properties": [
              {
                "namespace": "",
                "localname": "CustomerID",
                "name": "CustomerID"
              },
              {
                "namespace": "",
                "localname": "ShipAddress",
                "name": "ShipAddress"
              },
              {
                "namespace": "",
                "localname": "ShipCity",
                "name": "ShipCity"
              }
            ]
          },
          "algorithms": {
            "stdAlgorithm": {
              "timestamp": {
                "path": ""
              }
            },
            "custom": [],
            "collections": {
              "onMerge": {
                "add": {
                  "collection": [
                    "test"
                  ]
                },
                "remove": {
                  "collection": [
                    ""
                  ]
                },
                "set": {
                  "collection": [
                    ""
                  ]
                }
              },
              "onNoMatch": {
                "add": {
                  "collection": [
                    ""
                  ]
                },
                "remove": {
                  "collection": [
                    ""
                  ]
                },
                "set": {
                  "collection": [
                    ""
                  ]
                }
              },
              "onNotification": {
                "add": {
                  "collection": [
                    ""
                  ]
                },
                "remove": {
                  "collection": [
                    ""
                  ]
                },
                "set": {
                  "collection": [
                    ""
                  ]
                }
              },
              "onArchive": {
                "add": {
                  "collection": [
                    ""
                  ]
                },
                "remove": {
                  "collection": [
                    ""
                  ]
                },
                "set": {
                  "collection": [
                    ""
                  ]
                }
              }
            }
          },
          "mergeStrategies": [],
          "merging": [
            {
              "propertyName": "CustomerID",
              "sourceWeights": []
            },
            {
              "propertyName": "ShipCity",
              "sourceWeights": []
            },
            {
              "propertyName": "ShipAddress",
              "sourceWeights": []
            }
          ]
        },
        "matchOptions": {
          "dataFormat": "json",
          "propertyDefs": {
            "property": [
              {
                "localname": "CustomerID",
                "name": "CustomerID"
              },
              {
                "localname": "ShipCity",
                "name": "ShipCity"
              },
              {
                "localname": "ShipAddress",
                "name": "ShipAddress"
              }
            ]
          },
          "algorithms": {
            "algorithm": [
            ]
          },
          "collections": {
            "content": []
          },
          "scoring": {
            "add": [
              {
                "propertyName": "CustomerID",
                "weight": "10"
              },
              {
                "propertyName": "ShipCity",
                "weight": "5"
              },
              {
                "propertyName": "ShipAddress",
                "weight": "20"
              }
            ],
            "expand": [],
            "reduce": []
          },
          "actions": {
            "action": []
          },
          "thresholds": {
            "threshold": [
              {
                "above": "14",
                "label": "Likely Match",
                "action": "notify"
              },
              {
                "above": "24",
                "label": "Definitive Match",
                "action": "merge"
              }
            ]
          },
          "tuning": {
            "maxScan": 200
          }
        },
        "targetDatabase": "data-hub-FINAL"
      },
      "customHook": null,
      "retryLimit": 0,
      "batchSize": 100,
      "threadCount": 4
    }
  }
}
