{
  "name": "CustomerByValue",
  "options": {
    "collections": [
      "CustomerByValue"
    ],
    "targetEntity": "Customer",
    "sourceQuery": "cts.values(cts.uriReference())",
    "sourceQueryIsScript": true,
    "writeStepOutput": false
  },
  "description": "flow description",
  "steps": {
    "1": {
      "stepDefinitionName": "CustomerByValue",
      "stepDefinitionType": "CUSTOM",
      "options": {
        "sourceDatabase": "data-hub-FINAL",
        "targetDatabase": "data-hub-FINAL"
      }
    }
  }
}
