{
  "name": "ingestion_only-flow",
  "description": "This is the default flow containing all of the default steps",
  "batchSize": 100,
  "threadCount": 4,
  "options": {
    "sourceQuery": null
  },
  "steps": {
    "1": {
      "name": "json-ingest-step-json",
      "description": "ingests json docs in JSON format to data-hub-STAGING",
      "stepDefinitionName": "default-ingestion",
      "stepDefinitionType": "INGESTION",
      "options": {
        "sourceQuery": null,
        "collections": [
          "json-ingest-step-json"
        ],
        "permissions": "rest-reader,read,rest-writer,update",
        "outputFormat": "json",
        "targetDatabase": "data-hub-STAGING"
      },
      "customHook": {},
      "retryLimit": 0,
      "batchSize": 100,
      "threadCount": 4,
      "fileLocations": {
        "inputFilePath": "input",
        "inputFileType": "json",
        "outputURIReplacement": ".*input*.,'/ingestion-flow/json/'"
      }
    },
    "2": {
      "name": "xml-ingest-step-xml",
      "description": "ingests xml docs in XML formart to data-hub-STAGING",
      "stepDefinitionName": "default-ingestion",
      "stepDefinitionType": "INGESTION",
      "options": {
        "sourceQuery": null,
        "collections": [
          "xml-ingest-step-xml"
        ],
        "permissions": "rest-reader,read,rest-writer,update",
        "outputFormat": "xml",
        "targetDatabase": "data-hub-STAGING"
      },
      "customHook": {},
      "retryLimit": 0,
      "batchSize": 100,
      "threadCount": 4,
      "fileLocations": {
        "inputFilePath": "input",
        "inputFileType": "xml",
        "outputURIReplacement": ".*input*.,'/ingestion-flow/xml/'"
      }
    },
    "3": {
      "name": "csv-ingest-step-json",
      "description": "ingests csv file in JSON formart to data-hub-STAGING",
      "stepDefinitionName": "default-ingestion",
      "stepDefinitionType": "INGESTION",
      "options": {
        "sourceQuery": null,
        "collections": [
          "csv-ingest-step-json"
        ],
        "permissions": "rest-reader,read,rest-writer,update",
        "outputFormat": "json",
        "targetDatabase": "data-hub-STAGING"
      },
      "customHook": {},
      "retryLimit": 0,
      "batchSize": 100,
      "threadCount": 4,
      "fileLocations": {
        "inputFilePath": "input",
        "inputFileType": "csv",
        "outputURIReplacement": ".*input*.,'/ingestion-flow/csv/json/'"
      }
    },
    "4": {
      "name": "csv-ingest-step-xml",
      "description": "ingests csv docs in XML formart to data-hub-STAGING",
      "stepDefinitionName": "default-ingestion",
      "stepDefinitionType": "INGESTION",
      "options": {
        "sourceQuery": null,
        "collections": [
          "csv-ingest-step-xml"
        ],
        "permissions": "rest-reader,read,rest-writer,update",
        "outputFormat": "xml",
        "targetDatabase": "data-hub-STAGING"
      },
      "customHook": {},
      "retryLimit": 0,
      "batchSize": 100,
      "threadCount": 4,
      "fileLocations": {
        "inputFilePath": "input",
        "inputFileType": "csv",
        "outputURIReplacement": ".*input*.,'/ingestion-flow/csv/xml/'"
      }
    },
    "5" : {
      "name" : "ingest-binary",
      "description" : "ingests binary docs into data-hub-STAGING",
      "options" : {
        "sourceQuery" : null,
        "collections" : [ "ingest-binary" ],
        "outputFormat" : "json",
        "targetDatabase" : "data-hub-STAGING"
      },
      "customHook" : { },
      "retryLimit" : 0,
      "batchSize" : 0,
      "threadCount" : 0,
      "stepDefinitionName" : "default-ingestion",
      "stepDefinitionType" : "INGESTION",
      "fileLocations" : {
        "inputFilePath" : "input",
        "outputURIReplacement" : ".*input*.,'/ingestion-flow/binary/'",
        "inputFileType" : "binary"
      }
    }, 
    "6" : {
      "name" : "json-ingest-step-text",
      "description" : "ingests json docs into data-hub-STAGING in text format",
      "options" : {
        "sourceQuery" : null,
        "collections" : [ "json-ingest-step-text" ],
        "outputFormat" : "text",
        "targetDatabase" : "data-hub-STAGING"
      },
      "customHook" : { },
      "retryLimit" : 0,
      "batchSize" : 0,
      "threadCount" : 0,
      "stepDefinitionName" : "default-ingestion",
      "stepDefinitionType" : "INGESTION",
      "fileLocations" : {
        "inputFilePath" : "input",
        "outputURIReplacement" : ".*input*.,'/ingestion-flow/json/txt/'",
        "inputFileType" : "json"
      }
    },
    "7" : {
      "name" : "xml-ingest-step-text",
      "description" : "ingests binary docs into data-hub-STAGING",
      "options" : {
        "sourceQuery" : null,
        "collections" : [ "xml-ingest-step-text" ],
        "outputFormat" : "text",
        "targetDatabase" : "data-hub-STAGING"
      },
      "customHook" : { },
      "retryLimit" : 0,
      "batchSize" : 0,
      "threadCount" : 0,
      "stepDefinitionName" : "default-ingestion",
      "stepDefinitionType" : "INGESTION",
      "fileLocations" : {
        "inputFilePath" : "input",
        "outputURIReplacement" : ".*input*.,'/ingestion-flow/xml/txt/'",
        "inputFileType" : "xml"
      }
    }
  }
}
